{
  "$schema": "https://crossforge.dev/schemas/release-component.schema.json",
  "component": "toolchain/gcc-testsuite-qualification",
  "dependencies": [
    {
      "canonical_sha256": "28de071754474b53c0ed117c2ebb57cc93d5073aca244a116c4d748ea1757d28",
      "component": "rpm/host-gcc-test"
    },
    {
      "canonical_sha256": "dc11cd02c41cfb6d7bf667b1e695c4e44c403c32262b68f660f58ee3dd812648",
      "component": "sources/gcc"
    },
    {
      "canonical_sha256": "69f9adfa8b2bf70be6bdffe1f2bb152234fc23095d96af29df8ecfe9feabc3a3",
      "component": "toolchain/aarch64-qualification"
    },
    {
      "canonical_sha256": "b1b420e361b9fdd5cb0cc672ca6fe1bbe00055cdcc3a804463019a907c5f588c",
      "component": "toolchain/x86_64-qualification"
    }
  ],
  "kind": "crossforge-release-component",
  "materials": [
    {
      "path": "/gcc_testsuite/baselines/0/canonical_sha256",
      "value": "5f712cb3de4a3a7ecb1d2d28af8ce7bab517d27605b4660582c632ec21220f8c"
    },
    {
      "path": "/gcc_testsuite/baselines/0/file",
      "value": "tests/gcc/baselines/smoke/x86_64-host-direct.json"
    },
    {
      "path": "/gcc_testsuite/baselines/0/runtime_tier",
      "value": "host-direct"
    },
    {
      "path": "/gcc_testsuite/baselines/0/target",
      "value": "x86_64-unknown-linux-gnu"
    },
    {
      "path": "/gcc_testsuite/baselines/1/canonical_sha256",
      "value": "99b817ec770c9d7f7f1170af0ae109a1b3a5f6745cc69f9fa38afca237726426"
    },
    {
      "path": "/gcc_testsuite/baselines/1/file",
      "value": "tests/gcc/baselines/smoke/aarch64-locked-sysroot.json"
    },
    {
      "path": "/gcc_testsuite/baselines/1/runtime_tier",
      "value": "locked-sysroot"
    },
    {
      "path": "/gcc_testsuite/baselines/1/target",
      "value": "aarch64-unknown-linux-gnu"
    },
    {
      "path": "/gcc_testsuite/baselines/2/canonical_sha256",
      "value": "e30cd8d67e71706fafe3831f6bfa4d358acdaf4f605b314ff7d6f9edda11cc8a"
    },
    {
      "path": "/gcc_testsuite/baselines/2/file",
      "value": "tests/gcc/baselines/smoke/aarch64-clean-rocky.json"
    },
    {
      "path": "/gcc_testsuite/baselines/2/runtime_tier",
      "value": "clean-rocky"
    },
    {
      "path": "/gcc_testsuite/baselines/2/target",
      "value": "aarch64-unknown-linux-gnu"
    },
    {
      "path": "/gcc_testsuite/full/baselines/0/canonical_sha256",
      "value": "ca521cebedacc41d5d01edffec3182d33b7ba7df560c56b9bb6abe5cdf94161c"
    },
    {
      "path": "/gcc_testsuite/full/baselines/0/file",
      "value": "tests/gcc/baselines/full/x86_64-host-direct.json"
    },
    {
      "path": "/gcc_testsuite/full/baselines/0/runtime_tier",
      "value": "host-direct"
    },
    {
      "path": "/gcc_testsuite/full/baselines/0/target",
      "value": "x86_64-unknown-linux-gnu"
    },
    {
      "path": "/gcc_testsuite/full/plan/canonical_sha256",
      "value": "8a080fd490c0533807c8287104241331e2765c6a136208fd3e155eb717ad82ad"
    },
    {
      "path": "/gcc_testsuite/full/plan/file",
      "value": "config/gcc-testsuite-full.json"
    },
    {
      "path": "/gcc_testsuite/full/profile",
      "value": "full"
    },
    {
      "path": "/gcc_testsuite/plan/canonical_sha256",
      "value": "517de2af8c2d8ce2eee2bd100c3be35db2c97ee5ef3f81558c6ba6fe7a270324"
    },
    {
      "path": "/gcc_testsuite/plan/file",
      "value": "config/gcc-testsuite-smoke.json"
    },
    {
      "path": "/gcc_testsuite/profile",
      "value": "smoke"
    }
  ],
  "schema_version": 1,
  "scope": "qualification"
}
