{
  "$schema": "https://crossforge.dev/schemas/release-component.schema.json",
  "component": "python/cp312-qualification",
  "dependencies": [
    {
      "canonical_sha256": "7a9483931bdf27923336c0f48ee48328343998e3dbaeaa8cd6c33ee53b92ba03",
      "component": "python/cp312-aarch64-qualification"
    },
    {
      "canonical_sha256": "a8d720ee4ae3261f87614c6df9210773039831fa85c28623bf8de242c956d098",
      "component": "python/cp312-x86_64-qualification"
    }
  ],
  "kind": "crossforge-release-component",
  "materials": [
    {
      "path": "/python/versions/3/adapter",
      "value": "modern"
    },
    {
      "path": "/python/versions/3/version",
      "value": "3.12.14"
    }
  ],
  "schema_version": 1,
  "scope": "qualification"
}
