{
  "$schema": "https://crossforge.dev/schemas/release-component.schema.json",
  "component": "python/cp313-native-build",
  "dependencies": [
    {
      "canonical_sha256": "645286459f503ee163911bbeb6d6609c35885108021a1b442eb0e88ad3767652",
      "component": "python/cp313-source"
    },
    {
      "canonical_sha256": "fa2f3eb463731de9c0723cdfcfc49563ad8762a8165b471f24f67291728dd51d",
      "component": "rpm/host-build-common"
    },
    {
      "canonical_sha256": "3a3c0c9e014032d1a38b20962133c83bcdb7a6f59914f1974832e6f0f18ef7a0",
      "component": "rpm/host-python-build"
    }
  ],
  "kind": "crossforge-release-component",
  "materials": [
    {
      "path": "/baseline",
      "value": "el8"
    },
    {
      "path": "/platforms/build",
      "value": "linux/amd64"
    },
    {
      "path": "/platforms/image",
      "value": "linux/amd64"
    },
    {
      "path": "/platforms/tool_host",
      "value": "linux/amd64"
    }
  ],
  "schema_version": 1,
  "scope": "build"
}
