{
  "$schema": "https://crossforge.dev/schemas/release-component.schema.json",
  "component": "sources/vcpkg",
  "dependencies": [],
  "kind": "crossforge-release-component",
  "materials": [
    {
      "path": "/vcpkg/registry_license/expression",
      "value": "MIT"
    },
    {
      "path": "/vcpkg/registry_license/license_file",
      "value": "LICENSE.txt"
    },
    {
      "path": "/vcpkg/registry_license/license_sha256",
      "value": "1ee376fc340e0aa6ad6a3581c94126e741468705096ac92263048a21daa86460"
    },
    {
      "path": "/vcpkg/registry_license/notice_file",
      "value": "NOTICE.txt"
    },
    {
      "path": "/vcpkg/registry_license/notice_sha256",
      "value": "e46407f44d1f439e1f62fdfd1479418cf221d90e8d8fd27bfa4a362e23065c87"
    },
    {
      "path": "/vcpkg/release/commit",
      "value": "9e593bb18ea69cc5095e012465dcd675a822ed0d"
    },
    {
      "path": "/vcpkg/release/commit_evidence",
      "value": "evidence/git/vcpkg-2026.07.29.commit.b64"
    },
    {
      "path": "/vcpkg/release/status",
      "value": "locked"
    },
    {
      "path": "/vcpkg/release/tag",
      "value": "2026.07.29"
    },
    {
      "path": "/vcpkg/release/tag_evidence",
      "value": "evidence/git/vcpkg-2026.07.29.tag.b64"
    },
    {
      "path": "/vcpkg/release/tag_object",
      "value": "c76c06644034521fb761a39f8f52d8e87d1103d5"
    },
    {
      "path": "/vcpkg/repository",
      "value": "https://github.com/microsoft/vcpkg.git"
    },
    {
      "path": "/vcpkg/tool/commit",
      "value": "98d7cb0cf1f4686a3e43aa5672b6230c1d56bce8"
    },
    {
      "path": "/vcpkg/tool/commit_evidence",
      "value": "evidence/git/vcpkg-tool-2026-07-27.commit.b64"
    },
    {
      "path": "/vcpkg/tool/license/expression",
      "value": "MIT"
    },
    {
      "path": "/vcpkg/tool/license/license_file",
      "value": "licenses/vcpkg-tool/LICENSE.txt"
    },
    {
      "path": "/vcpkg/tool/license/license_sha256",
      "value": "16e3c9cdb4fa14a8627bc4b5ef0237773a79c3ad1d012c288f37e29573e116cc"
    },
    {
      "path": "/vcpkg/tool/license/notice_file",
      "value": "licenses/vcpkg-tool/NOTICE.txt"
    },
    {
      "path": "/vcpkg/tool/license/notice_sha256",
      "value": "6b9a0fc7d06f94019adc9705b92d0b2e53509f23f9d43744bbd663aa2c1597d5"
    },
    {
      "path": "/vcpkg/tool/repository",
      "value": "https://github.com/microsoft/vcpkg-tool.git"
    },
    {
      "path": "/vcpkg/tool/sha256",
      "value": "7e97ef6bcd58f74d079f40d086b801a0222c5d15e4ea0d8d507a538033493d04"
    },
    {
      "path": "/vcpkg/tool/sha512",
      "value": "be59d1fdf3725d2fb4bd1c0b435266726aaff2f87cb2503b775f44fb9b392ab474e6370d7e90e9d07b2c584b7deacc0670f98b477905c2e0d5cba5e01cee93dc"
    },
    {
      "path": "/vcpkg/tool/signature/evidence",
      "value": "evidence/gpg/vcpkg-glibc-2026-07-27.sig.b64"
    },
    {
      "path": "/vcpkg/tool/signature/key/file",
      "value": "keys/MICROSOFT-RELEASE-KEY.asc"
    },
    {
      "path": "/vcpkg/tool/signature/key/fingerprint",
      "value": "bc528686b50d79e339d3721ceb3e94adbe1229cf"
    },
    {
      "path": "/vcpkg/tool/signature/key/sha256",
      "value": "2fa9c05d591a1582a9aba276272478c262e95ad00acf60eaee1644d93941e3c6"
    },
    {
      "path": "/vcpkg/tool/signature/sha256",
      "value": "8b7176edd2699187c021ab72ae2c2713bafb2b1daabf4c320eaa05c13b2e80c7"
    },
    {
      "path": "/vcpkg/tool/signature/size",
      "value": 481
    },
    {
      "path": "/vcpkg/tool/signature/url",
      "value": "https://github.com/microsoft/vcpkg-tool/releases/download/2026-07-27/vcpkg-glibc.sig"
    },
    {
      "path": "/vcpkg/tool/size",
      "value": 8548168
    },
    {
      "path": "/vcpkg/tool/source/archive_root",
      "value": "vcpkg-tool-98d7cb0cf1f4686a3e43aa5672b6230c1d56bce8"
    },
    {
      "path": "/vcpkg/tool/source/cmakelists_sha256",
      "value": "5d0a8e47501857e3883d427e702ed7904f57a55817de1fc55784604c9d5c32e1"
    },
    {
      "path": "/vcpkg/tool/source/entrypoint_sha256",
      "value": "d62b4e2a8074b25b094ccf1d99730e6c6c43df8c744d114b94c3657359bccca7"
    },
    {
      "path": "/vcpkg/tool/source/member_count",
      "value": 2457
    },
    {
      "path": "/vcpkg/tool/source/sha256",
      "value": "5b0142bc8cd44e5ac7e7539257245be44ec6d695b863fc090f4e56589fed50dd"
    },
    {
      "path": "/vcpkg/tool/source/size",
      "value": 2990430
    },
    {
      "path": "/vcpkg/tool/source/status",
      "value": "locked"
    },
    {
      "path": "/vcpkg/tool/source/url",
      "value": "https://github.com/microsoft/vcpkg-tool/archive/98d7cb0cf1f4686a3e43aa5672b6230c1d56bce8.tar.gz"
    },
    {
      "path": "/vcpkg/tool/status",
      "value": "locked"
    },
    {
      "path": "/vcpkg/tool/tag",
      "value": "2026-07-27"
    },
    {
      "path": "/vcpkg/tool/url",
      "value": "https://github.com/microsoft/vcpkg-tool/releases/download/2026-07-27/vcpkg-glibc"
    }
  ],
  "schema_version": 1,
  "scope": "build"
}
