{
  "$schema": "https://crossforge.dev/schemas/release-component.schema.json",
  "component": "zstd/host-build",
  "dependencies": [
    {
      "canonical_sha256": "be14b05aebc58eeb91642e1f3fb019cba033e4801fe489c727e88c7b6bfa1a93",
      "component": "implementation/zstd-build-policy"
    },
    {
      "canonical_sha256": "fa2f3eb463731de9c0723cdfcfc49563ad8762a8165b471f24f67291728dd51d",
      "component": "rpm/host-build-common"
    },
    {
      "canonical_sha256": "6622b38249173dc6521ef3a412f656df5774d2d77c2d86fd21f91dba01e802e5",
      "component": "sources/zstd"
    }
  ],
  "kind": "crossforge-release-component",
  "materials": [
    {
      "path": "/baseline",
      "value": "el8"
    },
    {
      "path": "/platforms/build",
      "value": "linux/amd64"
    },
    {
      "path": "/platforms/image",
      "value": "linux/amd64"
    },
    {
      "path": "/platforms/tool_host",
      "value": "linux/amd64"
    }
  ],
  "schema_version": 1,
  "scope": "build"
}
