{
  "$schema": "https://crossforge.dev/schemas/release-component.schema.json",
  "component": "python/cp311-x86_64-qualification",
  "dependencies": [
    {
      "canonical_sha256": "275e4815224bc36e8e2b73c4ab97ad717ff7e02b64f15a15e3280317277be510",
      "component": "implementation/python-cp311-qualification-policy"
    },
    {
      "canonical_sha256": "b0484e934292f1239bae108756f41293f82e671603fa0aa5a1fef7b30ba012ce",
      "component": "python/cp311-source"
    },
    {
      "canonical_sha256": "90cb4a2b26ad4624c6a5710a35b28d3c47d5d9823e1d75caa530e8c71f0b1774",
      "component": "python/cp311-x86_64-build"
    },
    {
      "canonical_sha256": "316963ef38a843b13bd9656a73f8d1d3f7c6b6a167323a0ddf89144cb85cae89",
      "component": "rpm/sysroot-x86_64"
    },
    {
      "canonical_sha256": "b1b420e361b9fdd5cb0cc672ca6fe1bbe00055cdcc3a804463019a907c5f588c",
      "component": "toolchain/x86_64-qualification"
    }
  ],
  "kind": "crossforge-release-component",
  "materials": [
    {
      "path": "/abi/provider_manifest/canonical_sha256",
      "value": "709de9e38920b315e29bfb4e0c40763a8632697942a836140252ea5665de7de9"
    },
    {
      "path": "/abi/provider_manifest/file",
      "value": "config/abi-providers.json"
    },
    {
      "path": "/abi/python/provider_catalogs/x86_64/canonical_sha256",
      "value": "048b180ab090eb993ed47e92b1d9f923f332c82993b0eaa126a19d64ab07faed"
    },
    {
      "path": "/abi/python/provider_catalogs/x86_64/file",
      "value": "evidence/abi/el8-x86_64-python-provider-catalog.json"
    },
    {
      "path": "/abi/python/runtime_provider_policy/canonical_sha256",
      "value": "c25692ca24d11c13328f758f96dec49a81bb574763c08f9a437a139f1f363960"
    },
    {
      "path": "/abi/python/runtime_provider_policy/file",
      "value": "config/python-runtime-providers.json"
    },
    {
      "path": "/abi/targets/x86_64/baseline/canonical_sha256",
      "value": "efaaceb1b9264f04f8abd4f94724649b116e99532969d61027e825681fff8944"
    },
    {
      "path": "/abi/targets/x86_64/baseline/file",
      "value": "abi/el8/x86_64.json"
    },
    {
      "path": "/abi/targets/x86_64/sysroot_inventory/canonical_sha256",
      "value": "4f65a4b1770d96f8cadf46e7927ee40638f348f7fc218093f3059ca27d577534"
    },
    {
      "path": "/abi/targets/x86_64/sysroot_inventory/file",
      "value": "evidence/abi/el8-x86_64-sysroot.json"
    },
    {
      "path": "/base_image/digest",
      "value": "sha256:e8a49c5403b687db05d4d67333fa45808fbe74f36e683cec7abb1f7d0f2338c6"
    },
    {
      "path": "/base_image/index_evidence",
      "value": "evidence/oci/rocky-linux-8.index.json.b64"
    },
    {
      "path": "/base_image/manifests/amd64",
      "value": "sha256:f5529992e67440c1a4ae7788244d4381c6909159a88eacd95b7523ae47ced82e"
    },
    {
      "path": "/base_image/manifests/arm64",
      "value": "sha256:f514765516176a9aa4729ee83964e5a1900df95fd4bc7182cca64c7199b7eec7"
    },
    {
      "path": "/base_image/repository",
      "value": "quay.io/rockylinux/rockylinux"
    },
    {
      "path": "/base_image/tag",
      "value": "8"
    },
    {
      "path": "/baseline",
      "value": "el8"
    },
    {
      "path": "/python/versions/2/adapter",
      "value": "transition"
    },
    {
      "path": "/python/versions/2/patches/0/file",
      "value": "patches/cpython/3.11/0001-gh-115382-isolate-target-sysconfig.patch"
    },
    {
      "path": "/python/versions/2/patches/0/sha256",
      "value": "072dacfcc57b06bc1e5382726990627593a36e1f08232cb790db42ae334a49aa"
    },
    {
      "path": "/python/versions/2/source/sha256",
      "value": "91bcdebfdde239a003ae93738a7fce0f9230fee5c4bc2b86f6e6e8c6f98aabe8"
    },
    {
      "path": "/python/versions/2/source/sigstore/bundle_evidence",
      "value": "evidence/sigstore/cpython-3.11.16.tar.xz.sigstore.b64"
    },
    {
      "path": "/python/versions/2/source/sigstore/bundle_sha256",
      "value": "c2e6222a3d80c6acb99c13d8084bee23802d51ecbfe0e8b74718c0a92274c39e"
    },
    {
      "path": "/python/versions/2/source/sigstore/bundle_size",
      "value": 7309
    },
    {
      "path": "/python/versions/2/source/sigstore/bundle_url",
      "value": "https://www.python.org/ftp/python/3.11.16/Python-3.11.16.tar.xz.sigstore"
    },
    {
      "path": "/python/versions/2/source/sigstore/identity",
      "value": "pablogsal@python.org"
    },
    {
      "path": "/python/versions/2/source/sigstore/oidc_issuer",
      "value": "https://accounts.google.com"
    },
    {
      "path": "/python/versions/2/source/sigstore/verification",
      "value": "verified"
    },
    {
      "path": "/python/versions/2/source/size",
      "value": 20328716
    },
    {
      "path": "/python/versions/2/source/status",
      "value": "locked"
    },
    {
      "path": "/python/versions/2/source/url",
      "value": "https://www.python.org/ftp/python/3.11.16/Python-3.11.16.tar.xz"
    },
    {
      "path": "/python/versions/2/support",
      "value": "security"
    },
    {
      "path": "/python/versions/2/version",
      "value": "3.11.16"
    },
    {
      "path": "/targets/0/arch",
      "value": "x86_64"
    },
    {
      "path": "/targets/0/sysroot/canonical_sha256",
      "value": "ffe67b4d7448b02be7db774c8d85fdc8b13da695c0184de444949c641876ef57"
    },
    {
      "path": "/targets/0/sysroot/lock_file",
      "value": "locks/sysroot-el8-x86_64.json"
    },
    {
      "path": "/targets/0/sysroot/status",
      "value": "locked"
    },
    {
      "path": "/targets/0/triple",
      "value": "x86_64-unknown-linux-gnu"
    }
  ],
  "schema_version": 1,
  "scope": "qualification"
}
