{
  "$schema": "https://crossforge.dev/schemas/release-component.schema.json",
  "component": "python/cp313-x86_64-build",
  "dependencies": [
    {
      "canonical_sha256": "a428511db9354cf7798ee6c934863cc359d1837b9dd8f90bc3bab34177ab57c0",
      "component": "python/cp313-native-build"
    },
    {
      "canonical_sha256": "639bdd7c9185ba832790744b2323f95bc4854d2da1aa7c7931ed8f9f0b0ae2a1",
      "component": "toolchain/x86_64-build"
    }
  ],
  "kind": "crossforge-release-component",
  "materials": [
    {
      "path": "/targets/0/arch",
      "value": "x86_64"
    },
    {
      "path": "/targets/0/sysroot/canonical_sha256",
      "value": "ffe67b4d7448b02be7db774c8d85fdc8b13da695c0184de444949c641876ef57"
    },
    {
      "path": "/targets/0/sysroot/lock_file",
      "value": "locks/sysroot-el8-x86_64.json"
    },
    {
      "path": "/targets/0/sysroot/status",
      "value": "locked"
    },
    {
      "path": "/targets/0/triple",
      "value": "x86_64-unknown-linux-gnu"
    }
  ],
  "schema_version": 1,
  "scope": "build"
}
