{
  "$schema": "https://crossforge.dev/schemas/release-component.schema.json",
  "component": "implementation/vcpkg-upstream-tier2-qualification",
  "dependencies": [],
  "kind": "crossforge-release-component",
  "materials": [
    {
      "path": "/@implementation/vcpkg-upstream-tier2/assets/0/filename",
      "value": "curl-curl-curl-8_21_0.tar.gz"
    },
    {
      "path": "/@implementation/vcpkg-upstream-tier2/assets/0/sha256",
      "value": "ec753aa6f408a3ca9f0d6d5f7a77417aecd1544db13c03ae5d443612bf367364"
    },
    {
      "path": "/@implementation/vcpkg-upstream-tier2/assets/0/sha512",
      "value": "0ab6c99c3d5b86fb65c526db517c3159b11db2f8d82552d635c4887059c0602288603c93b754ce0ec543ea2f275122ccec2c8dcd866c2611b5b949c728ee72df"
    },
    {
      "path": "/@implementation/vcpkg-upstream-tier2/assets/0/size",
      "value": 3592963
    },
    {
      "path": "/@implementation/vcpkg-upstream-tier2/assets/0/url",
      "value": "https://github.com/curl/curl/archive/curl-8_21_0.tar.gz"
    },
    {
      "path": "/@implementation/vcpkg-upstream-tier2/assets/1/filename",
      "value": "madler-zlib-v1.3.2.tar.gz"
    },
    {
      "path": "/@implementation/vcpkg-upstream-tier2/assets/1/sha256",
      "value": "b99a0b86c0ba9360ec7e78c4f1e43b1cbdf1e6936c8fa0f6835c0cd694a495a1"
    },
    {
      "path": "/@implementation/vcpkg-upstream-tier2/assets/1/sha512",
      "value": "16fea4df307a68cf0035858abe2fd550250618a97590e202037acd18a666f57afc10f8836cbbd472d54a0e76539d0e558cb26f059d53de52ff90634bbf4f47d4"
    },
    {
      "path": "/@implementation/vcpkg-upstream-tier2/assets/1/size",
      "value": 1566911
    },
    {
      "path": "/@implementation/vcpkg-upstream-tier2/assets/1/url",
      "value": "https://github.com/madler/zlib/archive/v1.3.2.tar.gz"
    },
    {
      "path": "/@implementation/vcpkg-upstream-tier2/assets/2/filename",
      "value": "openssl-openssl-openssl-3.6.3.tar.gz"
    },
    {
      "path": "/@implementation/vcpkg-upstream-tier2/assets/2/sha256",
      "value": "c5524dd6bfaa8e8ff0f1be885c390d14f3ff0bd2de62a7311b65fcbb75cb7546"
    },
    {
      "path": "/@implementation/vcpkg-upstream-tier2/assets/2/sha512",
      "value": "a89c08101fa1d7e3c09b14f4a90d450bcf336a4f6a3e6e4ea990e4deddcd9ce250472f9114438fd134ff4b47fe93dd47232308567088b2b1c0b2eb50e3b56bdf"
    },
    {
      "path": "/@implementation/vcpkg-upstream-tier2/assets/2/size",
      "value": 55132237
    },
    {
      "path": "/@implementation/vcpkg-upstream-tier2/assets/2/url",
      "value": "https://github.com/openssl/openssl/archive/openssl-3.6.3.tar.gz"
    },
    {
      "path": "/@implementation/vcpkg-upstream-tier2/binary_sources",
      "value": "clear"
    },
    {
      "path": "/@implementation/vcpkg-upstream-tier2/downloads",
      "value": "forbidden"
    },
    {
      "path": "/@implementation/vcpkg-upstream-tier2/files/0/path",
      "value": "consumer.c"
    },
    {
      "path": "/@implementation/vcpkg-upstream-tier2/files/0/sha256",
      "value": "a197ad39f22476e4d4fdea66eb3857c405fd83e05b3c46ef18316a75fcc479ff"
    },
    {
      "path": "/@implementation/vcpkg-upstream-tier2/files/1/path",
      "value": "manifest/vcpkg.json"
    },
    {
      "path": "/@implementation/vcpkg-upstream-tier2/files/1/sha256",
      "value": "51ac756cf1a47443b6e50be475857e68b091c30214a2fcf1e9c6f68d2f75f5fb"
    },
    {
      "path": "/@implementation/vcpkg-upstream-tier2/ports/0/name",
      "value": "curl"
    },
    {
      "path": "/@implementation/vcpkg-upstream-tier2/ports/0/port_version",
      "value": 1
    },
    {
      "path": "/@implementation/vcpkg-upstream-tier2/ports/0/version",
      "value": "8.21.0"
    },
    {
      "path": "/@implementation/vcpkg-upstream-tier2/ports/1/name",
      "value": "openssl"
    },
    {
      "path": "/@implementation/vcpkg-upstream-tier2/ports/1/port_version",
      "value": 0
    },
    {
      "path": "/@implementation/vcpkg-upstream-tier2/ports/1/version",
      "value": "3.6.3"
    },
    {
      "path": "/@implementation/vcpkg-upstream-tier2/ports/2/name",
      "value": "zlib"
    },
    {
      "path": "/@implementation/vcpkg-upstream-tier2/ports/2/port_version",
      "value": 1
    },
    {
      "path": "/@implementation/vcpkg-upstream-tier2/ports/2/version",
      "value": "1.3.2"
    },
    {
      "path": "/@implementation/vcpkg-upstream-tier2/required_features/curl/0",
      "value": "core"
    },
    {
      "path": "/@implementation/vcpkg-upstream-tier2/required_features/curl/1",
      "value": "openssl"
    },
    {
      "path": "/@implementation/vcpkg-upstream-tier2/required_features/openssl/0",
      "value": "core"
    },
    {
      "path": "/@implementation/vcpkg-upstream-tier2/required_features/zlib/0",
      "value": "core"
    },
    {
      "path": "/@implementation/vcpkg-upstream-tier2/schema_version",
      "value": 1
    },
    {
      "path": "/@implementation/vcpkg-upstream-tier2/triplets/0",
      "value": "crossforge-host-x64-el8"
    },
    {
      "path": "/@implementation/vcpkg-upstream-tier2/triplets/1",
      "value": "crossforge-x64-el8"
    },
    {
      "path": "/@implementation/vcpkg-upstream-tier2/triplets/2",
      "value": "crossforge-x64-el8-dynamic"
    },
    {
      "path": "/@implementation/vcpkg-upstream-tier2/triplets/3",
      "value": "crossforge-arm64-el8"
    },
    {
      "path": "/@implementation/vcpkg-upstream-tier2/triplets/4",
      "value": "crossforge-arm64-el8-dynamic"
    }
  ],
  "schema_version": 1,
  "scope": "qualification"
}
