{
  "$schema": "https://crossforge.dev/schemas/release-component.schema.json",
  "component": "future/python-cp314",
  "dependencies": [],
  "kind": "crossforge-release-component",
  "materials": [
    {
      "path": "/python/versions/5/adapter",
      "value": "modern"
    },
    {
      "path": "/python/versions/5/patches",
      "value": []
    },
    {
      "path": "/python/versions/5/source/sha256",
      "value": "3b48dac8fb59f62eaa67ac83c1eb12bda1b7a08406dd286e252c11a66be27f81"
    },
    {
      "path": "/python/versions/5/source/sigstore/bundle_evidence",
      "value": "evidence/sigstore/cpython-3.14.7.tar.xz.sigstore.b64"
    },
    {
      "path": "/python/versions/5/source/sigstore/bundle_sha256",
      "value": "6f41efc358b146b5548dbfc0414e9247441f8524fb6ef59f1c4ca946ffc70701"
    },
    {
      "path": "/python/versions/5/source/sigstore/bundle_size",
      "value": 7101
    },
    {
      "path": "/python/versions/5/source/sigstore/bundle_url",
      "value": "https://www.python.org/ftp/python/3.14.7/Python-3.14.7.tar.xz.sigstore"
    },
    {
      "path": "/python/versions/5/source/sigstore/identity",
      "value": "hugo@python.org"
    },
    {
      "path": "/python/versions/5/source/sigstore/oidc_issuer",
      "value": "https://github.com/login/oauth"
    },
    {
      "path": "/python/versions/5/source/sigstore/verification",
      "value": "archived-unverified"
    },
    {
      "path": "/python/versions/5/source/size",
      "value": 24053924
    },
    {
      "path": "/python/versions/5/source/status",
      "value": "locked"
    },
    {
      "path": "/python/versions/5/source/url",
      "value": "https://www.python.org/ftp/python/3.14.7/Python-3.14.7.tar.xz"
    },
    {
      "path": "/python/versions/5/support",
      "value": "bugfix"
    },
    {
      "path": "/python/versions/5/version",
      "value": "3.14.7"
    }
  ],
  "schema_version": 1,
  "scope": "future"
}
