{
  "$schema": "https://crossforge.dev/schemas/release-component.schema.json",
  "component": "host-tools/cmake",
  "dependencies": [
    {
      "canonical_sha256": "d083d530430bac2b26d229f11083450f68405c9aa0c3b84a867983bd82b5b640",
      "component": "host-tools/ninja"
    },
    {
      "canonical_sha256": "c7fe36f8a0e743c8179db499f84ba0bae8d1e11c806ea42e121cacb811d01f60",
      "component": "implementation/cmake-host-tool"
    },
    {
      "canonical_sha256": "15bebccbafc2f5b849de9b0f36ec694fb0cc829aebada4d936c1c595ec1ef029",
      "component": "rpm/host-runtime"
    },
    {
      "canonical_sha256": "824dc4d1d83760cc432745c883b2966c73f870f0531705cf9a12ed9f7a3c4355",
      "component": "sources/cmake"
    }
  ],
  "kind": "crossforge-release-component",
  "materials": [
    {
      "path": "/baseline",
      "value": "el8"
    },
    {
      "path": "/platforms/build",
      "value": "linux/amd64"
    },
    {
      "path": "/platforms/image",
      "value": "linux/amd64"
    },
    {
      "path": "/platforms/tool_host",
      "value": "linux/amd64"
    }
  ],
  "schema_version": 1,
  "scope": "build"
}
