{
  "$schema": "https://crossforge.dev/schemas/release-component.schema.json",
  "component": "python/cp314-qualification",
  "dependencies": [
    {
      "canonical_sha256": "384d21f1415158191ac186c338c157efbf23eb00987d9ce0e9e86ee59811780a",
      "component": "python/cp314-aarch64-qualification"
    },
    {
      "canonical_sha256": "b2a96537dcb9c11e62f5baeb71a59faaae19d3f47cdaddba07ecd804c0182b30",
      "component": "python/cp314-x86_64-qualification"
    }
  ],
  "kind": "crossforge-release-component",
  "materials": [
    {
      "path": "/python/versions/5/adapter",
      "value": "modern"
    },
    {
      "path": "/python/versions/5/version",
      "value": "3.14.7"
    }
  ],
  "schema_version": 1,
  "scope": "qualification"
}
